{
  "version": "1",
  "agents": [
    {
      "id": "aos/arbiter",
      "name": "Arbiter",
      "author": "aos-framework",
      "description": "Neutral decision synthesizer. Frames strategic questions, drives multi-perspective debate, and synthesizes competing viewpoints into actionable, ranked recommendations with documented dissent.",
      "tags": ["orchestrator", "synthesis", "decision-making"],
      "source": "https://github.com/aos-framework/aos-framework",
      "version": "0.1.0",
      "compatible_profiles": ["aos/strategic-council", "aos/architecture-review", "aos/delivery-ops", "aos/incident-response", "aos/security-review"],
      "schema_version": "aos/agent/v1"
    },
    {
      "id": "aos/advocate",
      "name": "Advocate",
      "author": "aos-framework",
      "description": "User voice and behavior reality analyst. Grounds every proposal in real user behavior, adoption friction, and workflow integration.",
      "tags": ["perspective", "user-research", "adoption", "product"],
      "source": "https://github.com/aos-framework/aos-framework",
      "version": "0.1.0",
      "compatible_profiles": ["aos/strategic-council", "aos/delivery-ops"],
      "schema_version": "aos/agent/v1"
    },
    {
      "id": "aos/architect",
      "name": "Architect",
      "author": "aos-framework",
      "description": "Feasibility and systems thinking strategist. Grounds proposals in technical reality, operational complexity, and system durability.",
      "tags": ["perspective", "architecture", "systems-thinking", "feasibility"],
      "source": "https://github.com/aos-framework/aos-framework",
      "version": "0.1.0",
      "compatible_profiles": ["aos/strategic-council", "aos/architecture-review", "aos/delivery-ops", "aos/incident-response", "aos/security-review"],
      "schema_version": "aos/agent/v1"
    },
    {
      "id": "aos/catalyst",
      "name": "Catalyst",
      "author": "aos-framework",
      "description": "Acceleration and monetization strategist. Pushes for commercial velocity, revenue capture, and shipping speed.",
      "tags": ["perspective", "monetization", "growth", "velocity"],
      "source": "https://github.com/aos-framework/aos-framework",
      "version": "0.1.0",
      "compatible_profiles": ["aos/strategic-council", "aos/architecture-review", "aos/delivery-ops"],
      "schema_version": "aos/agent/v1"
    },
    {
      "id": "aos/navigator",
      "name": "Navigator",
      "author": "aos-framework",
      "description": "Market positioning and competitive timing strategist. Maps competitive landscapes and identifies timing windows for go-to-market viability.",
      "tags": ["perspective", "market", "positioning", "competitive-analysis"],
      "source": "https://github.com/aos-framework/aos-framework",
      "version": "0.1.0",
      "compatible_profiles": ["aos/strategic-council", "aos/security-review", "aos/delivery-ops"],
      "schema_version": "aos/agent/v1"
    },
    {
      "id": "aos/pathfinder",
      "name": "Pathfinder",
      "author": "aos-framework",
      "description": "Asymmetric opportunity hunter and 10x thinker. Challenges incrementalism and identifies step-function moves where upside dwarfs downside.",
      "tags": ["perspective", "innovation", "moonshot", "opportunity"],
      "source": "https://github.com/aos-framework/aos-framework",
      "version": "0.1.0",
      "compatible_profiles": ["aos/strategic-council", "aos/architecture-review"],
      "schema_version": "aos/agent/v1"
    },
    {
      "id": "aos/provocateur",
      "name": "Provocateur",
      "author": "aos-framework",
      "description": "Assumption-breaker and stress-tester. Challenges consensus, surfaces hidden assumptions, and forces the assembly to prove it is not fooling itself.",
      "tags": ["perspective", "stress-testing", "assumptions", "contrarian"],
      "source": "https://github.com/aos-framework/aos-framework",
      "version": "0.1.0",
      "compatible_profiles": ["aos/strategic-council", "aos/architecture-review", "aos/incident-response", "aos/security-review"],
      "schema_version": "aos/agent/v1"
    },
    {
      "id": "aos/sentinel",
      "name": "Sentinel",
      "author": "aos-framework",
      "description": "Protection and durability strategist. Safeguards long-term value, user trust, and retention against proposals that erode compounding assets.",
      "tags": ["perspective", "risk", "trust", "retention", "protection"],
      "source": "https://github.com/aos-framework/aos-framework",
      "version": "0.1.0",
      "compatible_profiles": ["aos/strategic-council", "aos/architecture-review", "aos/delivery-ops", "aos/incident-response", "aos/security-review"],
      "schema_version": "aos/agent/v1"
    },
    {
      "id": "aos/strategist",
      "name": "Strategist",
      "author": "aos-framework",
      "description": "Problem selection and sequencing specialist. Ensures the team works on the right problems in the right order based on impact-per-effort.",
      "tags": ["perspective", "strategy", "prioritization", "sequencing"],
      "source": "https://github.com/aos-framework/aos-framework",
      "version": "0.1.0",
      "compatible_profiles": ["aos/strategic-council", "aos/delivery-ops"],
      "schema_version": "aos/agent/v1"
    },
    {
      "id": "aos/auditor",
      "name": "Auditor",
      "author": "aos-framework",
      "description": "Retrospective analyst and institutional memory. Tracks decision patterns, surfaces historical precedent, and ensures the organization learns from past decisions.",
      "tags": ["operational", "audit", "institutional-memory", "retrospective"],
      "source": "https://github.com/aos-framework/aos-framework",
      "version": "0.1.0",
      "compatible_profiles": ["aos/strategic-council", "aos/incident-response"],
      "schema_version": "aos/agent/v1"
    },
    {
      "id": "aos/operator",
      "name": "Operator",
      "author": "aos-framework",
      "description": "Execution reality analyst. Grounds every plan in team capacity, dependency chains, and delivery risk to test whether proposals can actually be built.",
      "tags": ["operational", "execution", "delivery", "capacity"],
      "source": "https://github.com/aos-framework/aos-framework",
      "version": "0.1.0",
      "compatible_profiles": ["aos/strategic-council", "aos/architecture-review", "aos/delivery-ops", "aos/incident-response", "aos/security-review"],
      "schema_version": "aos/agent/v1"
    },
    {
      "id": "aos/steward",
      "name": "Steward",
      "author": "aos-framework",
      "description": "Ethics, compliance, and governance guardian. Prevents decisions that create legal, regulatory, or reputational exposure.",
      "tags": ["operational", "compliance", "ethics", "governance"],
      "source": "https://github.com/aos-framework/aos-framework",
      "version": "0.1.0",
      "compatible_profiles": ["aos/strategic-council", "aos/architecture-review", "aos/incident-response", "aos/security-review"],
      "schema_version": "aos/agent/v1"
    }
  ],
  "profiles": [
    {
      "id": "aos/strategic-council",
      "name": "Strategic Council",
      "author": "aos-framework",
      "description": "Multi-perspective strategic deliberation. A neutral Arbiter orchestrates 11 specialist agents who debate, challenge, and stress-test from opposing perspectives.",
      "agent_count": 12,
      "tags": ["strategy", "deliberation", "decision-making", "multi-perspective"],
      "source": "https://github.com/aos-framework/aos-framework",
      "version": "0.1.0"
    },
    {
      "id": "aos/architecture-review",
      "name": "Architecture Review",
      "author": "aos-framework",
      "description": "Technical architecture evaluation. Assesses system design decisions against feasibility, scalability, and long-term maintainability.",
      "agent_count": 8,
      "tags": ["architecture", "technical", "review", "scalability"],
      "source": "https://github.com/aos-framework/aos-framework",
      "version": "0.1.0"
    },
    {
      "id": "aos/delivery-ops",
      "name": "Delivery Ops",
      "author": "aos-framework",
      "description": "Product delivery orchestration. Plans and sequences feature delivery with execution reality checks and go/no-go criteria.",
      "agent_count": 8,
      "tags": ["delivery", "operations", "planning", "execution"],
      "source": "https://github.com/aos-framework/aos-framework",
      "version": "0.1.0"
    },
    {
      "id": "aos/incident-response",
      "name": "Incident Response",
      "author": "aos-framework",
      "description": "Rapid multi-perspective incident analysis. Analyzes root causes, failure modes, operational impact, and prevention strategies.",
      "agent_count": 7,
      "tags": ["incident", "response", "root-cause", "postmortem"],
      "source": "https://github.com/aos-framework/aos-framework",
      "version": "0.1.0"
    },
    {
      "id": "aos/security-review",
      "name": "Security Review",
      "author": "aos-framework",
      "description": "Security assessment and remediation planning. Identifies vulnerabilities and produces a prioritized remediation plan with a risk matrix.",
      "agent_count": 7,
      "tags": ["security", "assessment", "vulnerability", "remediation"],
      "source": "https://github.com/aos-framework/aos-framework",
      "version": "0.1.0"
    }
  ],
  "domains": [
    {
      "id": "aos/fintech",
      "name": "Fintech & Financial Services Context",
      "author": "aos-framework",
      "description": "Domain pack for financial services, payments, lending, and investment platforms. Injects fintech-specific lexicon, compliance standards, and agent overlays.",
      "tags": ["fintech", "finance", "payments", "compliance", "banking"],
      "source": "https://github.com/aos-framework/aos-framework",
      "version": "0.1.0"
    },
    {
      "id": "aos/healthcare",
      "name": "Healthcare & Life Sciences Context",